job_title,job_category,company_name,requirements,location,industry,salary
Senior Geotechnical Engineer,software engineer,EASi,"Must be a Registered Professional Engineer (P.Eng.) or Professional Geoscientist (P.Geo.) with Engineers & Geoscientists BC or with another jurisdiction and eligible for registration as such with Engineers & Geoscientists BCMust have experience working as an engineer in similar roles in BCMust have 8+ years’ experience in Geotechnical Engineering roles.Must have excellent written & verbal communication skills as report writing is an essential part of this role.Must be willing to travel within BC for field assignments and work in remote areas for extended periods of time.Strong verbal and written communication skills are required. Must be able to prepare clear, concise engineering reports and proposals.Experience as leading projects working as Project Engineer and Professional or Record.Must be a self-starter, be able to work independently and as part of a team, should have a desire to learn and take on new challenges.Valid British Columbia Class 5 driver’s license.Knowledge and experience in geological engineering including: Rock mechanics, Surficial geology mapping, Soils and rock characterization, Local and regional geologic history, Geologic models, Soil mechanics, Geohazards, Site investigation, In-situ testing and lab testing, Deformation and seepage analyses, Dam engineering and analysis, Dam performance assessment, Dam surveillance, geotechnical instrumentation and monitoring, Grouting and ground improvement, Seismic hazard, and geotechnical earthquake engineering, Seepage and groundwater transport, Slope stability analysis, Design of rockfall protection measuresWorking knowledge of relevant software, including Rocscience products (RS2, RocFall. Dips, etc., Geoslope (Slope/w, Seep/w, etc.), FLAC, PLAXIS, VERSAT, FEFLOW, MODFLOW, etc.Ability to work independently, exercising judgment and initiative with limited supervision.Ability to analyze and resolve challenging and unusual engineering problems by incorporating innovative design and/or analysis methods.Strong interpersonal, communication, and organizational skills and the ability to work in a team environment.Strong proficiency of both written and oral communication in English and be able to prepare well-written technical reports and clearly present work to an audience.Ability to provide technical directions to junior engineersAbility to manage design tasks including scope, schedule and costAbility to find engineering solutions that add value and to reach consensusAbility to communicate efficiently including verbal and technical writing in the English language, analytical, interpersonal communications and presentation skillsExperience in project management including estimating, cost control, and project administration","Burnaby, BC",Nothing_found,$65 an hour
Electrical Engineer,software engineer,Voltas Engineering Ltd.,"Electrical design of power distribution, control, communication, lighting, fire alarm and security systems for industrial, commercial, institutional and municipal sectors.Technical calculations and software use for lighting analyses, load calculations, arc flash, fault & & coordination studies, power system design.Assisting intermediate/senior engineers to produce drawings including but not limited to substation physical layouts and sections, material take offs, single line diagrams, three line diagrams, schematics, and wiring diagrams.On site electrical research, construction audits, field reviews.Writing detailed and concise technical reports, feasibility studies, proposals, including written responses and instructions as required during all project phases.Conducting all tasks in cooperation with internal clients and other engineering disciplines.Managing and enhancing client relationships.Membership or eligibility for membership in the Association of Professional Engineers and Geoscientists of the Province of British Columbia (APEGBC).Ability to work independently to deliver comprehensive designs and contracts, often with demanding timelines.Experience creating tender document packages with drawings and specificationsExperience with utility companies, authorities having jurisdiction, and applicable codes, standards and work practices.Excellent working knowledge of AutoCAD.Experience with AutoCAD Electrical or similar drafting software.Knowledge of the Canadian Electrical Code and/or National Electrical Code.Exemplary interpersonal skills with team members and clients.A ""can do"" attitude, able to work in a team environment.Good initiative, attention to detail.Strong verbal and written communication and interpersonal skills.Working ConditionsSome Travel May be required from time to time.This job is performed indoors in traditional office setting with frequent visits to site.Extended health care8 hour shiftElectrical Engineering: 3 years (Preferred)Hiring LabCareer AdviceBrowse JobsBrowse CompaniesSalariesIndeed EventsWork at IndeedAboutHelp Centre© 2020 IndeedPrivacy CentreCookiesPrivacyTerms","Surrey, BC",Nothing_found,"$60,000 - $70,000 a year"
Implementation Engineer,software engineer,Pani Energy Inc,"Knowledge of processes applicable to water and wastewater treatment (Activated Sludge Process, membrane processes, chemical processes)Demonstrated ability to learn and apply engineering concepts quickly.Demonstrated ability to learn new software quickly.Excellent attention to detail and analytical skills.Highly organizedEager to be part of a fast-paced team.Casual dressDental careDisability insuranceExtended health careFlexible scheduleLife insuranceStock optionsVision careWork from home","Victoria, BC",Nothing_found,"$45,000 - $55,000 a year"
Molecular Modelling Lead,software engineer,HTuO Biosciences,"Ph.D. in a relevant field (computer science, physics, biology, chemistry, applied mathematics, etc).Experience with setting up and running Molecular modelling simulations.In-depth knowledge of molecular dynamics simulation, force field development, free energy computation, structure optimization.Experience coding in Python, C/C++, or similar languages, as well as version control, test driven development methodologies and OOP.Experience in machine learning would be an asset.Demonstrated experience in leadership would be an asset.","Vancouver, BC",Nothing_found,$17 - $79 an hour
Back End Developer,software engineer,Gluwa,Ability to develop software in C# (ASP.NET Core),"Vancouver, BC",Nothing_found,"$75,000 - $110,000 a year"
Intermediate Software Developer,software engineer,462038,4+ years of experience in software developmentExperience developing with ABP FrameworkBachelor’s degree in Computer Science or Computer Engineering (or a combination of related skills and experience)Relevant work experience,"Sechelt, BC",Nothing_found,$45 - $55 an hour
Project Manager,software engineer,GOKABU TECHNOLOGIES INC,Casual dressCompany eventsDental careDisability insuranceExtended health careLife insuranceOn-site parkingVision care,"Richmond, BC",Nothing_found,$30 - $35 an hour
Renovation/Construction Site Coordinator,software engineer,Construction & Restoration,Minimum 1 year experience in Construction/Contractor industry in a supervisory role requiredComfortable working with Xactimate SoftwareExperience as a contractor or carpenter is an assetExperience working in both residential and commercial buildingsStrong written and verbal communication skills with a people-oriented demeanorStrong project management skillsStrong negotiation skillsAbility to prioritize tasks on a daily basis and make adjustments if necessaryPossesses a dependable work ethicEffective time management and multitaskingStrong attention to detail requiredHighly organizedFamiliar with Work Safe BC Health & Safety regulationsValid and clean driver’s license,"Burnaby, BC",Nothing_found,"$49,000 - $54,000 a year"
JAVA Backend Developer,software engineer,Negocios IT Solutions LLC,"Support the migration from various on-premise architectures to AWS CloudDesign, develop and deploy web services, including APIs, back-end services and interfaces to mobile and web, hosted in a Cloud environmentWork with product owners, UX designers, mobile app developers and other stakeholders to understand requirements, and translate these into pragmatic and effective technical solutions, and an aligned delivery planActively participate in a collaborative team that applies principles of Agile, DevOps and CI/CD methodologies, and iterates in a design-build-test-measure cycleCoordinate with program managers and other teams to implement updates to back-end services in a timely mannerCreate technical designs and contribute to system architectureEnsure code quality through writing unit tests, automation and performing code reviewsContribute ideas to finding the best solutions for algorithms, technologies and products/tools to be adoptedExperience in building web services / backend servicesExperience with Amazon AWSStrong experience with JavaExperience with REST APIs and JSONExperience in the configuration and deployment of web servicesSolid software design knowledge – you should know how to create software that is extensible, reusable and meets desired architectural objectivesStrong aptitude and reasoningGreat communication skills, both oral and written5+ years in professional software developmentBachelor’s degree in Software/Computer Engineering, Computer Science or related field, or comparable relevant experienceSolid practitioner of the Agile/Scrum development process, ideally with test-driven development, DevOps and continuous integration/deployment (CI/CD)Experience with Authentication and Authorization technologies such as SAML, ActiveDirectoryExperience in developing Microservices or Business Services or APIsExperiences in creating web-based reports and dashboardsExperience with Python, JavaScript, LAMP or similar technologiesExperience with collecting, storing and consolidating analytics dataUnderstanding of Service Discovery, Inter-Service Communication, Service Deployment and Service Orchestration frameworksKnowledge of Kubernetes, Docker, Jenkins, Istio, Spinnaker, API Connect, KafkaQA skills in testing, scripting and test automationWillingness to learn new technologies and approachesReadiness to work in a global team with contributors from different backgrounds, skills and locationsIdeally 8+ years of experience8 hour shiftYes, temporarily due to COVID-19Hiring LabCareer AdviceBrowse JobsBrowse CompaniesSalariesIndeed EventsWork at IndeedAboutHelp Centre© 2020 IndeedPrivacy CentreCookiesPrivacyTerms","Vancouver, BC",Nothing_found,"$65,000 - $70,000 a year"
Mechanical Engineer - Water Treatment,software engineer,McCue Engineering Contractors,"Perform project management of water treatment system design and construction projects, with support from senior managers.Perform detailed mechanical layout designs of water treatment systems with equipment selection support from senior process engineers.Develop fabrication drawings outlining plan, profile, and section views of piping and equipment assemblies.Assist process engineers in the selection of mechanical equipment such as pumps and valves.Develop budget estimates for senior review and budget tracking/managementGenerate proposals for senior reviewAssist with sales by revising proposals as necessary based on customer feedbackImplement and maintain Health & Safety Plans (or completing first review) and supervise safety program on projectsDetermine solutions for projects and develop conceptual designsDevelop or complete first review of preliminary and detailed design work[RB1]Provide training on software / design principles to junior staff.Work with the management team to allocate McCue resources: personnel and equipmentPrepare material quantity take-offs and direct the procurement of supplies, materials and subcontractorsSupport field work and liaise with construction teamPerform field reviews of construction work and ensure that work complies with design requirements.Involve/update senior managers on project progressReport writing or complete first review of reports prepared by project team for submission to senior managementPrepare monthly billing summariesCommunicate with client project managersAssist with hiring of new staffAssist with orientation / training of new staffProvide feedback on staff performancePrioritize work in consultation with Engineering Manager and DirectorsMake recommendations to the Engineering Manager and Directors for operational changes/improvementsCommunication with Directors, management, engineers, workers, clients and subcontractors will be a critical part of this positionPromote company values at all timesMechanical Engineering degree and licence to practice in CanadaMinimum 8 years engineering and project management experienceDirect experience designing water treatment systemsLifecycle project management experienceCasual dressDental careExtended health careFlexible scheduleOn-site parkingPaid time offVision careWork from home8 hour shiftMonday to FridayBachelor's Degree (Required)Professional Engineering Licence (Required)Yes, alwaysHiring LabCareer AdviceBrowse JobsBrowse CompaniesSalariesIndeed EventsWork at IndeedAboutHelp Centre© 2020 IndeedPrivacy CentreCookiesPrivacyTerms","Delta, BC",Nothing_found,"$70,000 a year"
Mechanical Engineer,software engineer,Rocky Mountain,"Supporting all aspects of designing bike frames, which includes designing ancillary items and developing hardware for framesWorking closely with the R&D team, product managers, operations, and suppliersSupporting manufacturing and maintaining documentationWorking on suspension design and simulation (FEA)Supporting research projects.Bachelor’s degree in Engineering5 years minimum of work experience3 years minimum of design engineering experience within a manufacturing environmentProficient in 3D CAD modeling (software: Pro Engineer / Creo)Passion for bikes, good listening skills, and determinationExcellent interpersonal, written and verbal communication skillsProfessional, ethical and organisedAvailable to travel (once travel restrictions are lifted)Sense of urgency and able to work as part of a fast paced, creative team.Bike industry experienceKnowledge of mountain bike parts compatibility, and working proficiency of mechanic work3D CAD surfacing experienceFEA experienceComposites and aluminum manufacturing experience.Cover letterResumeGPAOne pager portfolio of your 3D CAD and FEA experiencesCompany eventsExtended health careFlexible schedulePaid time offProfit sharing8 hour shiftYes, temporarily due to COVID-19Hiring LabCareer AdviceBrowse JobsBrowse CompaniesSalariesIndeed EventsWork at IndeedAboutHelp Centre© 2020 IndeedPrivacy CentreCookiesPrivacyTerms","Vancouver, BC",Nothing_found,"$61,172 - $131,921 a year"
Machine Learning Engineer,software engineer,Boast.AI,"Bachelor's degree in Computer Science, related technical field or equivalent practical experience5+ years of experience developing Machine Learning or Artificial Intelligence features and applications in the SaaS software and/or fintech space5+ years of fullstack software development experienceExperience with one or more of the following: Natural Language Processing, text understanding, classification, pattern recognition, recommendation systems, targeting systems, ranking systems or similar.Experience with one or more general purpose programming languages including but not limited to: Python, Scala, Java, C, C++Knowledge of software engineering best practices across the development lifecycle, including agile methodologies, coding standards, code reviews, source management, build processes, testing, and operationsEffective written and verbal communication skillsDemonstrated problem-solving skillsAbility to work unsupervised, in the office or remote as part of a distributed team and be able to produce high quality workMS or Ph.D. degree in Computer Science, Artificial Intelligence, Machine Learning, or related technical field.Experience with Google Cloud architecture and productsExperience with one or more frameworks such as Tensorflow, Keras, Apache Beam, SparkDemonstrated leadership and self-direction. Willingness to teach others and learn new techniques.Python proficiencyInterest and ability to learn other coding languages as needed","Vancouver, BC",Nothing_found,"$80,000 - $110,000 a year"
QA Tester,software engineer,Navigator Games Ltd.,"Identify software defects, run test cases and verify fixesInform test plan creation to ensure complete testing coverage for our gamesEffectively communicate the progress and or updates status to management and StudioHelp manage the project database; ensuring high quality on bug entry, timely response on requests for more information, and proper bug flowReport feedback from clients customer satisfaction to managementTest in fast-paced environment with both long and short development cyclesParticipate in review of requirements and designsCollaborate with designers, producers and engineers in defining testing risksSupport live rapid deployment online serviceOther duties as the company may assign from time to time.Our ideal candidate will have 2+ years of quality assurance experience in the games industry, with a strong preference for mobile games testing.Experience in the free to play mobile RPG market is a plus.Strong proficiency with bug database software (such as Jira) and test suite management software (such as TestRail) is preferred.Strong working knowledge of Excel and familiarity with both iOS and AndroidPrevious experience with version control software (such as Perforce and SVN) and development software such as Unity is an asset, as is working with back end game admin and server tools.Familiarity and experience with using data and tuning sheets directly to inform testing will be considered a bonus.Dental careExtended health careFlexible scheduleWork from home8 hour shiftMonday to FridayQA: 2 years (Preferred)mobile gaming: 2 years (Preferred)Vancouver, BC (Required)English (Required)Yes, occasionallyHiring LabCareer AdviceBrowse JobsBrowse CompaniesSalariesIndeed EventsWork at IndeedAboutHelp Centre© 2020 IndeedPrivacy CentreCookiesPrivacyTerms","Vancouver, BC",Nothing_found,$16 - $18 an hour
Concept Artist,software engineer,Navigator Games Ltd.,"Create high quality concepts, illustrations, and designs of characters, props and special decor elements;Design environmental studies, atmospheric elements and screen overlays (paintovers);Develop conceptual ideas from scratch, providing in depth research and reference materials;Take account of technical constraints and limitations to propose realistic concepts;Proficient at creating drawings to serve as reference/foundation for 3D modelers, i.e. turn-arounds, orthographic renders, material guides, etc.;Create solid illustrations and renders of game elements to serve as guides to 3D Artists, inspirational guides, for marketing purposes;Collaborate and iterate with a passionate in-house team of artists, technical artists, engineers and designers to craft games for mobile and tablet devices;Follow the existing art style and assist in asset creation, ensuring concept art meets technical and visual quality standards;Clearly document workflows that will be used by internal and external teams, experience with Jira and Confluence a plus;Participate in production and art team meetings, brainstorming, art reviews, critiques;Keep up to date on the latest industry standard tools, workflows, and techniques;Deliver artwork and elements within deadlines set by production.Demonstrates a strong understanding of a broad mix of character related disciplines such as modeling, texturing, shading, rigging & binding, animation, and blend shapes.Interprets 2D reference material into 3D textured and surfaced models3+ years experience with concept design/visual development experience in video gamesPost secondary education in art, animation or a related field.Previous experience with Perforce and Unity a must.Important skills in conceptual art with a good understanding of perspective, form, color, light and atmosphereAdvanced experience with digital illustration software (ie. Photoshop)Working familiarity with Scrum/Agile project processesSelf-motivated, collaborative attitude in a team environmentStrong attention to detailExcellent communication, interpersonal, time management and organizational skillsDental careExtended health careWork from home8 hour shiftMonday to Fridayconcept design: 3 years (Required)video games: 2 years (Preferred)unity: 2 years (Preferred)Yes, temporarily due to COVID-19Hiring LabCareer AdviceBrowse JobsBrowse CompaniesSalariesIndeed EventsWork at IndeedAboutHelp Centre© 2020 IndeedPrivacy CentreCookiesPrivacyTerms","Vancouver, BC",Nothing_found,"$60,000 - $80,000 a year"
Technical Project Manager,software engineer,Boast.AI,Project Management: 1 year (Required)software development: 2 years (Required),"Vancouver, BC",Nothing_found,"$70,000 - $90,000 a year"
Golang Developer,software engineer,Strata Identity,"Use your deep understanding of Golang to build Strata’s Maverics identity orchestration platform.Participate and drive all stages of the SDLC using a methodology inspired by Pivotal Lab’s Agile model.Work with Product and Design closely to collaborate with other engineers and teams to implement new features, improvements, and fixes that need to handle our current and future scale.Build and Run software following a DevSecOps modelBuild new and maintain current features by contributing across the whole technical stack.Use Test-Driven Development to build, debug, and resolve production issues and implement fixes for them.Evaluate new technologies and techniques to improve overall practices.Instrument, monitor, and operate the code you write and services you build. This includes on-call rotations.Help with design and code review, and ensure good engineering practices are being applied.Contribute to key areas of large scale, Go-based Identity Management product development, being ready to lead where your expertise shinesWork closely with product management and architects to improve the products and develop new featuresMentor and be mentored, coach and be coached, as part of an ever-growing engineering team.Place a high value on security and reliability.Take an agile, iterative approach to development, dividing long-term goals into incremental milestones.Have the ability to be self-directed and be effective working independently, yet feel equally comfortable contributing in a team environment.Work well with technical and non-technical people to deliver high-value results.Enjoy being part of a highly collaborative, remote-friendly environment.Are a good communicator and enjoy interacting with people.Bring the right attitude to the team: ownership, accountability, and attention to detail.Possess the desire to learn and curiosity to understand how and why things work.Degree in Computer Science or equivalent work experience5+ years experience in software development and engineering for cloud-native or an enterprise software companyHelpful but not necessary Knowledge of on-premises identity (SiteMinder, OAM, ClearTrust, Ping, ForgeRock) and cloud identity (AzureAD, Okta, Google, and AWS)Experience with at least one standard network security protocol (SAML, OAuth, LDAP, and OIDC)Understanding of enterprise identity infrastructure and core security concerns of cloud and on-premises environmentsSolid experience with HTTP, Web application architectures, and cloud platforms.Experience with GoLang, Linux, networking, web, and app servers.Experience designing and developing large scale applications, including the design and implementation of modern web applicationsGrounding in modern software engineering practices and design patternsSolid understanding of the technical fundamentals of networking and cloud-based applicationsDental careMonday to FridayGOLANG: 3 years (Required)Yes, occasionallyRemote interview processSocial distancing guidelines in placeVirtual meetingsHiring LabCareer AdviceBrowse JobsBrowse CompaniesSalariesIndeed EventsWork at IndeedAboutHelp Centre© 2020 IndeedPrivacy CentreCookiesPrivacyTerms","Vancouver, BC",Nothing_found,"$100,000 - $136,407 a year"
Senior Structural Engineer,software engineer,StructureCraft Builders Inc.,Master’s or Doctorate Degree in Civil Engineering (or a related Engineering Degree).,"Abbotsford, BC",Nothing_found,"$110,000 - $130,000 a year"
Embedded Firmware - Intern,software engineer,Educoach Consultants Inc,8 Hour Shift8 Hour Shift,"Surrey, BC",Nothing_found,"$32,000 - $40,000 a year"
Full Stack (ReactJS/Python) Developer,software engineer,INTERSOG,"5+ years of experience with ReactJSStrong experience in implementing cross site (web based) integrationsWebpack and packaging (Javascript) software components for third party usageDocumenting Javascript interfaces and APIs for our partnersGenerating web based Previews and Embeddable componentsImplementing REST APIs in Python, preferably with Django and PostgreSQL","Vancouver, BC",Nothing_found,"$80,000 - $120,000 a year"
