job_title,job_category,company_name,requirements,location,industry,salary
Senior Lead Developer,software developer,VIIHEALTH,"You have already managed technical teams and appreciate teamwork ;You are an excellent communicator and know how to be the representative of the technical team;Support and supervise developers in the implementation of our changes and our fixes;You are proactive and not afraid to take initiative;Being the referent in terms of code, implementing good practices, and verifying the actions carried out by his team ;Participate in the definition of the roadmap in direct relation with the Product and Marketing team;Supported the development of new functionalities while respecting the roadmap;Being able to select the tools suited to our needs, Intervene on complex or critical developments and on the implementation of architectures on projects;Translated business needs into clear tasks for developers;Good knowledge of data security, coding standards, etc…Upstream participation in the technical decisions inherent in the proper implementation of the roadmap (technological choices, determination of development times, advice to project managers on the preparation of schedules, ...).A university or a college diploma in computer science;More than 5 years of experience in developing web application;Advanced level in PHP programming ;Knowledge of one or more PHP frameworks, such as Symfony, Laravel, Zend, CakePHP;Strong skills and experience with MySQL or other relational DB;Experience in producing functional and technical specifications;Experience in API architecture;Relevant experience and fluency with version control systems (Git);Relevant experience with collaboration tools like Confluence, Jira, Asana;Knowledge of cloud platforms (AWS or Azure) in a UNIX/Linux environnent;Knowledge of Docker platforms and container orchestration;Knowledge of NodeJS, Jenkins, unit tests (an asset)Intellectual aspects : Curious, dynamic person and always willing to suggest new ideas;Relational aspects : autonomous and able to work in a team;Methodological aspects : rigourous person taking care of details & professional awareness;We adopt a broad and inclusive definition of diversity and encourage all people, regardless of their characteristics to apply.8 hour shiftHiring LabCareer AdviceBrowse JobsBrowse CompaniesSalariesIndeed EventsWork at IndeedAboutHelp Centre© 2020 IndeedPrivacy CentreCookiesPrivacyTerms","Montréal, QC",Nothing_found,"$90,000 a year"
Houdini Pipeline Developer,software developer,Scanline VFX,"BA in Computer Science, or similar discipline (required)Three (3) to five (5) years of experience in VFX, Gaming or other professional Houdini software developmentExpert knowledge of HoudiniMust have knowledge of Alembic and VDB read/write implementations in Max and HoudiniPython, PyQt, and HScript scripting abilitiesExcellent problem-solving skillsGood interpersonal communication skillsBash/cshell/Linux knowledgeKnowledge of render queuing softwareUnderstanding of relational databases and/or SQLKnowledge of Shotgun or asset management a plusSome knowledge of Maya and Nuke a plusExperience with V-Ray and MAXScript is a plusC/C++ abilities is a plus","Montréal, QC","Arts, Entertainment & Recreation","$56,846 - $122,473 a year"
Senior Java Software Developer,software developer,CGI Group,"Build a highly scalable and high-performance architectureDesign and develop back-end data services, REST APIs, and web-based front-end for user profiles and other application support servicesWork with platform architects on software and system optimizations, helping to identify and remove potential performance bottlenecksWork with other software leads on developing testing processes and frameworksDocument the work you do, especially APIs that you createUnderstanding of business requirements and their mapping to a given software frameworkAdhering to SDLC methodology and design principles of SG software framework. Working in Agile, test-driven mode, in object-oriented environment.Ability to understand business requirements and business prioritiesAbility to understand complex technical architectureAbility to coordinate and facilitate project execution and delivery commitment with other IT Teams and other teams under different operational time zonesProactive on taking leadership when needed, self motivated, dynamic and result orientedTeam player with collaborate attitude, able to maintain highest level of discipline with respect to development frameworkFluent communication (oral and written) and listening skills7+ years of development and architecture experience with Java , SQL and Spring Boot2+ years of experience with modular, lightweight, event-driven Microservice architectures on a JVM stack2+ years of experience with Continuous Integration / Continuous Delivery using modern DevOps tools and workflows such as git, GitHub, Jira, and Jenkins4+ years of experience with agile development (Scrum, Kanban, etc) and Test Automation (behavior, unit, integration testing)5+ years of Object-Oriented development experience2+ years of web front-end developmentExperience with ReactJS and/or Angular developmentExperience with Docker platformMinimum of 5 years IT development experience.PostgreSQL or similar RDBMS backgroundExperience in web & front-end developmentDental careDisability insuranceEmployee assistance programEmployee stock purchase planExtended health careLife insuranceOn-site gymPaid time offProfit sharingRRSP matchTuition reimbursementVision careWellness program8 hour shiftDay shiftCI/CD: 2 years (Required)agile development (Scrum, Kanban, etc) and Test Automation: 4 years (Preferred)event-driven Microservice architectures: 2 years (Required)architecture experience with Java , SQL and Spring Boot: 7 years (Required)English (Required)Hiring LabCareer AdviceBrowse JobsBrowse CompaniesSalariesIndeed EventsWork at IndeedAboutHelp Centre© 2020 IndeedPrivacy CentreCookiesPrivacyTerms","Montréal, QC",Nothing_found,"$65,000 a year"
C# Developer,software developer,Genpact,"BE/B Tech/M Tech/MCA/BCAExcellent written and verbal communication skillsExperience in software design and development.Good C# programming skills for windows application. (Experience on WPF or WinForms is required)Able to understand Java.Understanding the SDLC and Relational database skills (SQL, Sybase)Knowledge of Basic scripting skills on Linux (Shell, Perl, Python)Good problem solving and communication skills who can work efficient in a team.Fast learner, able to control and produce high quality systems and documentationStrong cross-group teamwork and relationship leadership skills including coordinating with geographically dispersed teams to achieve workGood to have experience on dev-ops, such as quality gate, test automation, CI and CD, SOAP/XML, MQUnderstanding of multithreading and distributed programmingGood to have knowledge of Commodities/Finance experience is a plus Proven understanding of C#, Database: SQL server, Oracle and","Montréal, QC",Information Technology,"$80,000 - $90,000 a year"
Linux C++/Python Developer for Technological Arts,software developer,Société des arts technologiques (SAT),"Ubuntu, Linux, FOSSGcc, python3, cmakeGDB, clangRaspberry Pi, NVidia jetsonGitlab CI, Docker, AWS, AzureGitlab, JIRA, Confluence, Slack, Mozilla HubsReal-time audio-visualTCP/IPCross compilationKubernetesImmersive Space Editing and Prototyping: In situ editing (EiS)Multi-projector video mapping for all types of surfaces: SplashCalibration of projectors for immersive space: CalimiroSound spatialization for all types of speaker systems: SATIESound spatialization by acoustic simulation: vaRaysGroup interaction of people in an immersive space: SpookTelepresence and multichannel transmission in low latency: SwitcherSharing of all types of data streams between applications: ShmdataPaid time offMonday to FridayC++ / Python: 5 years (Preferred)Yes, temporarily due to COVID-19Hiring LabCareer AdviceBrowse JobsBrowse CompaniesSalariesIndeed EventsWork at IndeedAboutHelp Centre© 2020 IndeedPrivacy CentreCookiesPrivacyTerms","Montréal, QC",Nothing_found,"$46,819 a year"
Full Stack Web Developer,software developer,Cigo Tracker,"Contribute to new features in every aspect (from design, collaboration to full implementation)Refactor our legacy code and work on improving existing functionality. Be ready to attack the backlog and provide your feedback along the wayRespect software development standards and aim to deliver the best code possibleActively participate in the collaboration between the sales and development teams to bring Cigo to the next levelWork in a pleasant environment that ensures you grow and learn from the challenges you encounter daily in your workPHP 7.4+ (Yii 1.1, Yii 2.x)Node.jsHTTP REST API design and developmentOpen API spec design and developmentMySQL 8Cloud services and APIs such as: AWS (S3, SES, CloudFront, etc.), Azure, Twilio, etc.JavaScript (ECMAScript 2017/8)jQuery 3.4Bootstrap 3.4 & 4.xCSS3 & SCSSCompleted higher education in Computer Science or Software Engineering (B.Sc. and/or Masters)Solid experience in Full Stack Web DevelopmentSome experience building 3rd party platform integrations with e-commerce and accounting platforms (i.e. Shopify, WooCommerce, Magento, CRMs, QuickBooks, etc.)Experience designing, developing, and maintaining an Open APIConsiderable experience in Full Stack Web development using PHP (with an MVC framework, i.e. Laravel, Symfony, CakePHP, Yii), HTML, Bootstrap 3 and/or 4, JavaScript, and jQuery 3Experience working in smaller cross-functional teamsExperience working in agile/scrum development processComfortable working with Git and using a flow such as Git Flow (with master, release, develop and feature branches)Solid understanding of best practices regarding performance and security in web developmentComfortable with peer code reviews (receiving and giving constructive criticism)Comfortable working in modern IDEs such as PHPStorm, WebStorm, etc.Fluent in spoken and written EnglishA friendly personality! : )Experience working with AWS/Azure/Google Cloud platformsExperience working with RabbitMQ and socketsExperience working in a Continuous Integration environmentGit: 1 year (Required)HTML/CSS: 2 years (Required)JavaScript: 2 years (Preferred)jQuery: 1 year (Required)Node.js: 1 year (Preferred)PHP Framework (Laravel, Yii, Symfony, etc.): 2 years (Required)Scrum/Agile: 1 year (Preferred)Web MVC: 1 year (Required)Bachelor's Degree (Preferred)Montréal, QC (Required)English (Required)NoHiring LabCareer AdviceBrowse JobsBrowse CompaniesSalariesIndeed EventsWork at IndeedAboutHelp Centre© 2020 IndeedPrivacy CentreCookiesPrivacyTerms","Montréal, QC",Nothing_found,"$60,000 - $70,000 a year"
Lead Developer,software developer,VIIHEALTH,"Vous avez déjà managé des équipes techniques et appréciez le travail en équipe ;Accompagner et encadrer nos développeurs dans la mise en oeuvre de nos évolutions et nos correctifs.Vous êtes force de proposition et n'avez pas peur de prendre des initiatives.Etre le référent en matière de code, mettre en place de bonnes pratiques, et vérifier les actions menées par son équipeParticiper à la définition de la roadmap en relation directe avec l’équipe Produit et Marketing,Prendre en charge le développement des nouvelles fonctionnalités dans le respect de la roadmap.Être en mesure de sélectionner les outils adaptés à nos besoins,Traduire les besoins métier en tâches claires pour les développeurs.Bonne maitrise de la sécurité des données, codes…La participation en amont, aux décisions techniques inhérentes à la bonne mise en œuvre de la roadmap (choix technologiques, détermination des temps de développement, conseil aux chefs de projets sur l’élaboration des plannings,…) ;Un diplôme universitaire ou collégial en informatique.Plus de 5 années d'expérience à développer des applications web.Niveau avancé en programmation PHP.Connaissance d'un ou plusieurs cadres applicatifs (frameworks) PHP, tels que Symfony, Laravel, Zend, CakePHP, (idéalement Symfony)Solides compétences et expériences avec MySQL ou autre BD relationnel.Expérience en production de spécifications fonctionnelles et techniques.Expérience dans l'architecture d'API.De l'expérience pertinente et une aisance avec les systèmes de contrôles de versions (Git)Expérience avec des outils de collaboration, tels que Confluence, Jira, Asana.Connaissance des plates-formes cloud (AWS ou Azur) dans un environnement UNIX/Linux;Connaissance des plateformes Docker et d'orchestration de conteneurs ;Connaissance NodeJS, Jenkins, test unitaires (un atout)Aspects intellectuels : personne curieuse, dynamique et force de proposition.Aspects relationnels : autonome et capable de travailler en équipe.Aspects méthodologiques : personne rigoureuse prenant soin des détails. Conscience professionnelle.Nous adoptons une définition large et inclusive de la diversité et encourageons toutes les personnes, peu importe leurs caractéristiques, à poser leur candidature.Hiring LabCareer AdviceBrowse JobsBrowse CompaniesSalariesIndeed EventsWork at IndeedAboutHelp Centre© 2020 IndeedPrivacy CentreCookiesPrivacyTerms","Montréal, QC",Nothing_found,"$90,000 a year"
Senior Azure Cloud Solutions Architect | MONTRÉAL,software developer,Opticca Consulting,"Demonstrated experience with one or more IaaS technologies, such as Terraforms, Azure IaaS, etc.Experience with PaaS, such as AKS, Openshift, or othersProject experience with SQL or NoSQL DatabasesExperience with software defined Load balancers and load balancing best practicesDemonstrated experience with Cloud gateways, queues, messaging hubsHands-on experience with cloud services for DevOps, Container/Orchestration, networking, security, data, Big Data, and storage resourcesEngineering and/or software development experience and demonstrable architecture experience at enterprise scalePrior technology consulting experience desiredExperience in architecture and implementation of large and highly complex projectsDeep understanding of cloud computing infrastructure and platformsHistory of working successfully with cross-functional engineering teamsExperience with configuration management automation tools such as Chef, Puppet, AnsibleTerraformsStreaming data tools and techniques such as Apache Kafka, Azure Streaming Analytics, AWS Kinesis, or othersBig Data platforms e.g. Cloudera, Hortonworks MapRNoSQL environments such as MongoDB, CassandraContinuous delivery and deployment using Agile MethodologiesStructured, Unstructured, Semi-Structured Data techniques and processes","Montréal, QC",Nothing_found,"$150,000 a year"
Front End Developer,software developer,Sryas Inc.,"The candidate will participate in the various stages of software development for complex web applicationsThe candidate will participate in the development of the solution (design, ideation, technological choices ...)The candidate will work in an Agile environment.The candidate will contribute to the strategies and the vision of the front-end developmentPractical experience in web front-end development for at least 5 yearsExpertise in at least one of the technologies listed below:Vue.jsAngularReactJSExpertise in several of the technologies listed below:HTML5CSS3GITWebpackNPMExperience in supporting multiple browsersFunctional knowledge of French and EnglishDiploma in Computer Science (College or University)Expertise with DockerExpertise with Photoshop or similar toolsFamiliarity with macOS/Unix based systemsUnderstanding of the principles of accessibility for the WebSense of aesthetics and attention to detailDental careExtended health carePaid time offMonday to FridayReactJS: 5 years (Preferred)angular: 5 years (Preferred)Hiring LabCareer AdviceBrowse JobsBrowse CompaniesSalariesIndeed EventsWork at IndeedAboutHelp Centre© 2020 IndeedPrivacy CentreCookiesPrivacyTerms","Montréal, QC",Nothing_found,"$56,153 - $75,000 a year"
Tableau Developer,software developer,Genpact,"8 hour shiftYes, temporarily due to COVID-19Hiring LabCareer AdviceBrowse JobsBrowse CompaniesSalariesIndeed EventsWork at IndeedAboutHelp Centre© 2020 IndeedPrivacy CentreCookiesPrivacyTerms","Montréal, QC",Nothing_found,"$100,000 - $110,000 a year"
"Software Test Lead, Quality Assurance (QA) Engineer",software developer,Sliq Media,Relevant university degree or equivalent work experienceManual software testing best practicesAutomated testingWeb + mobile testingSelenium/AppiumBrowserstackAgile development processesDevOps experience and best practicesMicrosoft serverMicrosoft Azure (or other cloud environments)Team Foundation Server (TFS)PowershellVisual StudioRelease PipelinesSQLAbility to install and test Windows-based applications and servicesDiplôme universitaire pertinent ou expérience de travail équivalenteMeilleures pratiques de test manuel des logicielsTests automatisésTest Web + mobileSélénium / AppiumBrowserstackProcessus de développement agileDéveloppe les meilleures pratiquesServeur MicrosoftMicrosoft Azure (ou autres environnements cloud)TFSPowershell,"Montréal, QC",Information Technology,"$70,000 - $75,000 a year"
Sr. Java Developer with Database,software developer,Genpact,8 hour shift8 hour shift8 hour shift8 hour shift8 hour shift8 hour shift8 hour shift8 hour shift8 hour shift,"Montréal, QC",Information Technology,"$85,000 - $100,000 a year"
Intermediate C# / .Net Core Developer,software developer,Merchant Processor Solutions,"3+years' experience working with Visual Studio, SQL Server, C#, .NET, MVC, EntityFramework, Angular, Bootstrap and GitExcellent understanding of HTTP fundamentals and developing RESTful API servicesStrong command of Object Oriented Design and Programming conceptsSignificant knowledge of best practices for the development of complex business applicationsExcellent analytical skills required to facilitate strategic planning and solve technical and business problemsStrong communication skills (verbal and written)Self-motivated with the ability to take initiative and strong desire to learnExperience with web and enterprise application developmentExperience with Azure is an assetExperience with Azure DevOps Pipelines is an assetExperience with Agile development practicesBS or MS in Computer Science or equivalent3 years or more experience working on ASP.NET web applications (Web Forms and/or Razor).Au moins trois ans d'expérience professionnelle avec Visual Studio, SQL Server, C#, .NET, MVC, EntityFramework, Angular, Bootstrap et GitBonne compréhension des principes fondamentaux de HTTP et du développement de services RESTful APIForte maîtrise de la conception orientée objet et des concepts de programmationConnaissance approfondie des meilleures pratiques relatives au développement d'applications commerciales complexesExcellentes compétences analytiques permettant de faciliter la planification stratégique et de résoudre les problèmes techniques et commerciauxDe solides compétences en matière de communication (verbale et écrite)Autonome, avec la capacité de prendre des initiatives et un fort désir d'apprendreExpérience en matière de développement web et de développement de progicielsExpérience avec Azure, un atoutExpérience avec Azure DevOps Pipelines, un atoutExpérience en pratiques de développement AgileBaccalauréat ou maîtrise en informatique ou équivalentAu moins trois ans d'expérience professionnelle avec les applications web ASP.NET (web Forms et/ou Razor).","Montréal-Est, QC",Nothing_found,"$60,000 - $65,000 a year"
.NET C# MVC Developers,software developer,ARISOFT INC.,"Our client is a national Canadian leader in their sector. Their audience is consumers, businesses, and organizations across Canada. They are looking to hire a dedicated DEVELOPER who loves to program in a diverse environment. Their Development Team manages and builds the company’s websites, APIs, applications, and mobile websites/apps. Using the latest technologies, including; .NET Framework 4.5, MVC 5.1, Web API 2.0 and Team Foundation. Their platforms are custom-built, proprietary systems. They value doing things properly, and since you will be part of a small, agile team of developers, you will be expected to contribute significantly to all aspects of our technology stack. They emphasize teamwork, and each team member has the opportunity to contribute to work methods and implementation. Key Responsibilities · Designing, coding, testing, debugging, maintaining and documenting a diverse set of applications · Low level technical analysis · Assisting in the constant effort to transition to cutting edge technology services and platforms · Some DevOps and build/deployment duties, including management of our quality assurance and environments You will have the opportunity to be involved with and gain additional experience in client server applications, web applications, Cloud applications, mobile applications. Truly an opportunity to learn and growExperience with web services and API design principlesExperience with deployment/publishing of production-ready applicationsGood knowledge of Software development methodology and software lifecycle processesASP.NET Development: 10 years (Required)MVC: 5 years (Required).Net development: 5 years (Required)C#: 5 years (Required)Hiring LabCareer AdviceBrowse JobsBrowse CompaniesSalariesIndeed EventsWork at IndeedAboutHelp Centre© 2020 IndeedPrivacy CentreCookiesPrivacyTerms","Montréal, QC",Nothing_found,"$60,000 - $110,000 a year"
Senior Python Full Stack (HTML5 / js UI) Developer,software developer,Bewave,A BCS or DEC with equivalent experience. *,"Montréal, QC",Nothing_found,"$70,000 a year"
.Net Programmer - Analyst,software developer,Alithya,"Design and develop complex software solutions;Create unit tests and automated tests;Assist the QA team at the time of testing;Keep documentation up to date;Participate in start of production;Proactively monitor applications to propose improvements;Master the processes, procedures and work methods in place;Participate in planning, tracking and sprinting activities;Document the knowledge base of tools and development environments;Participate in the training and sponsorship of Junior Programmer Analysts;Get involved in organising and producing Lunch and Learn presentations.Ability to demonstrate a high degree of autonomy;Experience and creativity to solve complex problems;Diploma in Computer Science;Three (3) years of relevant experience in transactional development;Mastery of object-oriented programming (OO);Three (3) years of experience with WPF, MVVM, XAML/C # on .NET Framework 4.5 or higher as well as with SQL Server 2014 and above;One (1) year of experience with SOAP or REST-based Web Services, NUnit, TFS or GIT;Experience with .NET Core, Microsoft Azure Cloud Platform and Oracle would be considered an asset;Excellent knowledge of Agile and DevOps practices;Communication with teams in French and English.French: 4/4English: 4/437.5 hours per week;Opportunities to develop and grow your career;Work with diverse technologies, projects, clients and sectors;Spend your days in a creative and innovative environment;Share experience and knowledge as part of an agile and dynamic team;A great balance between work and personal life;Access to exciting educational opportunities (internal, conferences, events, courses, certifications, etc.);Personal recognition of your important professional contributions;Great cultural diversity across our teams.Casual dressCommuter benefitsCompany eventsDental careDisability insuranceEmployee assistance programEmployee stock purchase planExtended health careFlexible scheduleLife insuranceOn-site parkingPaid time offProfit sharingRRSP matchStock optionsStore discountVision careWellness programWork from homeMonday to Friday.Net Programmer: 4 years (Required)Yes, alwaysHiring LabCareer AdviceBrowse JobsBrowse CompaniesSalariesIndeed EventsWork at IndeedAboutHelp Centre© 2020 IndeedPrivacy CentreCookiesPrivacyTerms","Montréal, QC",Telecommunications,"$60,000 - $75,000 a year"
Senior DevOps Engineer | MONTRÉAL,software developer,Opticca Consulting,"Experience with one or more programming languages such as Java, PythonExperience with SQL or NoSQL databasesExperience with container and orchestration technologies such as Docker, Kubernetes, Openshift, or other similar solutions (both enterprise or open source)Experience with configuration management automation tools such as Chef, Puppet, AnsibleExperience with infrastructure in a cloud environment (Google, AWS, Azure)SQL Server database administration (including SSRS and SSAS) experience preferredMongo DB administration and Network administration experience preferredExperience with source code control systems, branching and merging, automated unit testing frameworks, automated build tools, and automated deploy frameworksExperience deploying enterprise systemsExperience with modern open source technologies, to help source control, packaging, deploying, automation, CD/CI, etc.","Montréal, QC",Nothing_found,"$120,000 a year"
UNITY Programmer,software developer,Bluberi Gaming,Baccalauréat en informatique ou diplôme d’études collégiales (DEC);Expérience professionnelle ou personnelle dans le développement et la programmation de jeux vidéo;2 ans d’expérience en programmation C#;,"Drummondville, QC",Nothing_found,"$50,000 - $70,000 a year"
