job_title,job_category,company_name,requirements,location,industry,salary
Full Stack Python Developer,software developer,Yellow Pencil,"A degree or diploma in computer science or a related field or comparable accreditation is an asset4+ years experience in web or application development, or a related fieldStrong experience with PythonKnowledge and interest in DevOpsRobust experience with Git and build pipelines, such as JenkinsDemonstrated troubleshooting and problem-solving capabilitiesExposure to public cloud architecture, preferably Google Cloud PlatformAbility to self-start and manage multiple tasks with minimum or little supervisionExcellent communication skills with the ability to explain technical concepts and scenarios to non-technical customers and team members","Edmonton, AB",Nothing_found,"$60,000 - $85,000 a year"
Java Developer,software developer,Synthesis Systems Inc,"4+ years of commercial software development experience using Java Spring Boot to expose and consume REST/GraphQL APISWorking knowledge of AWS as well as async message queues/topics via Spring JMS.Expertise with unit testing & Test-Driven Development (TDD)BS/MS in computing scienceHunger to continuously learn and innovate beyond what is currently acceptedEnterprise AWS DevOps experience (cloud watch monitoring/alerting, tomcat admin, etc)Containerization (Docker & Kubernetes)Deep expertise with functional testing tools such as KarateStrong aptitude for resiliency testing & performance tuning APIs that support real-time transactions at scaleDatabase programming (Oracle PL/SQL, DynamoDB) and optimization of database queries through HibernateUI experience (javascript, react)Machine Learning skills (Python, Tensor Flow, SageMaker)Ability to multi-task and switch contextData analysis and reporting skills (Qliksense)Experience with enterprise subscription billing and/or revenue recognition implementations (Oracle BRM, Revstream)","Edmonton, AB",Nothing_found,"$65,000 - $75,000 a year"
Web Game Developer,software developer,SVR Automation Intelligence,"Iterate on your work, refining those areas that could use and extra coat of polish, refactoring your code to maximize its efficiency and readability.Be ever learning and researching new things, and sharing the wisdom you develop with your team, as they will with you.Be willing to create samples & prototypes at various levels of fidelity, never blindly making changes & hoping it works out. You shouldn’t ever write what you don’t understand.Take the time to annotate your code, thoroughly explaining in comments that which could be confusing to look at later and/or which operates on a paradigm which might not be immediately obvious.Have a solid understanding of the medium, including but not limited to: Node.js, Mongo DB, Socket.io, React-native, responsive web apps, and native mobile apps.Have strong written and verbal communication skills, allowing you to communicate design intent/rationale to software developers, and product managers.Be confident working independently, proactively implementing tasks & features as needed, while actively communicating with your team when uncertainty arises.Be passionate about providing our customers with a great experience using our apps.Bonus payWeb Development: 2 years (Required)Node.js: 2 years (Required)Database management: 1 year (Preferred)Yes, alwaysHiring LabCareer AdviceBrowse JobsBrowse CompaniesSalariesIndeed EventsWork at IndeedAboutHelp Centre© 2020 IndeedPrivacy CentreCookiesPrivacyTerms","Edmonton, AB",Nothing_found,$19 - $28 an hour
Mobile Application Developer,software developer,MoneyPrep Inc,Bonus payBonus pay,"Edmonton, AB",Nothing_found,"$48,000 - $65,000 a year"
HVAC Controls Programmer,software developer,Silent-Aire,Bonus pay,"Edmonton, AB",Manufacturing,"$80,000 a year"
software engineer,software developer,BOLTZ,AboutHelp Centre,"Richmond, BC",Nothing_found,$45 an hour
software developer,software developer,ED Tech Solutions Inc.,Hiring LabCareer AdviceBrowse JobsBrowse CompaniesSalariesIndeed EventsWork at IndeedAboutHelp Centre,"Delta, BC",Nothing_found,$35.50 an hour
Software Developer,software developer,VANPLE NETWORKS,Hiring LabCareer AdviceBrowse JobsBrowse CompaniesSalariesIndeed EventsWork at IndeedAboutHelp Centre,"Vancouver, BC",Nothing_found,$42 an hour
software technical architect,software developer,Apisero Canada Inc.,Hiring LabCareer AdviceBrowse JobsBrowse CompaniesSalariesIndeed EventsWork at IndeedAboutHelp Centre,"Vancouver, BC",Nothing_found,"$250,000 - $275,000 a year"
software developer,software developer,Compuran as well as ITD Canada,Hiring LabCareer AdviceBrowse JobsBrowse CompaniesSalariesIndeed EventsWork at IndeedAboutHelp Centre,"Vancouver, BC",Nothing_found,$34.29 an hour
Web developer,software developer,G 5ABI Media Inc.,Hiring LabCareer AdviceBrowse JobsBrowse CompaniesSalariesIndeed EventsWork at IndeedAboutHelp Centre,"Surrey, BC",Nothing_found,$30.50 an hour
software engineer,software developer,ClickDishes Inc.,Hiring LabCareer AdviceBrowse JobsBrowse CompaniesSalariesIndeed EventsWork at IndeedAboutHelp Centre,"Vancouver, BC",Nothing_found,"$62,400 a year"
Front End Engineer II,software developer,"AMZN CAN Fulfillment Svcs, ULC","Bachelors in Computer Science or related field5+ years professional experience in software development inculding experience with front-end technologies and frameworks like React, Redux, Ember or Angular and RESTful web services and designing and building sophisticated and efficient user interfacesHealth CareSavings PlansIncome ProtectionPaid Time OffSigning BonusesEmployee StockHiring LabCareer AdviceBrowse JobsBrowse CompaniesSalariesIndeed EventsWork at IndeedAboutHelp Centre© 2020 IndeedPrivacy CentreCookiesPrivacyTerms","Vancouver, BC",Information Technology,"$103,000 - $172,000 a year"
Backend / Cloud developer - Energy Management & Lean Manufacturing,software developer,Panevo Services Limited,> 2 years of experience in a similar role,"Vancouver, BC",Manufacturing,"$58,753 - $100,000 a year"
"Sales Development Leader, Enterprise Software (REMOTE)",software developer,Flosum,Bachelor's Degree (Required),"Victoria, BC",Nothing_found,"$80,000 - $90,000 a year"
Strategic Business Development Manager - Enterprise Software CAN (Remote),software developer,Flosum,"The ideal leader will have 10 plus years prior business development and global alliances leadership experience in a software sales environment; driving partner revenue and growth with key Systems Integrators and Business partners through an enterprise sales force.Ability to thrive in a fast-paced, high-growth environment.Must be a team player who is goal-oriented and confident, with aptitude and desire to build high-performing dispersed team. This individual must demonstrate an ability to get things done, build consensus, resolve conflict, and solve tough business problems, working in concert with others.Strong capabilities in building and executing channel strategies by segment and geography, creating and presenting sales plans, setting milestones, measuring performance and being accountable for results to executive management.Strong leadership and influencing skills: the ability to obtain results in an organization that he/she does not control.Pre-existing relationships with Global Systems Integrators will be preferred.","Victoria, BC",Nothing_found,"$80,000 - $90,000 a year"
Front-end Web Developer (React + NodeJS),software developer,Confirmit,"friendly, smart and easy to work withopen to test driven development ideas and understand the importance of building quality into your softwarehumble, and enjoy helping your colleagues and appreciate their guidance in return","Vancouver, BC",Nothing_found,"$80,000 - $110,000 a year"
Front End Developer / Customer Success,software developer,Gist Applications,"Excellent HTML, CSS, and Javascript skillsAbility to problem solve, and debug issues across Shopify themes and appsAbility to politely, and effectively communicate with clients via email, and phoneExcellent verbal and written communication skillsPrevious experience working with the Shopify platformKnowledge of Liquid templating languageA portfolio showcasing your previous workExperience working with GitA full stack developer mentalityKnowledge of PHP or other server side languagesAbility to create visually appealing layoutsEagerness to learn and grow your skillsKnowledge of package management and deployment toolsRespond to customer requests in an effective and timely manner.Complete modifications and customizations to clients online stores.Build + customize online stores from pre-existing templates.Search for, find, and fix compatibility issues between clients themes, and third party appsProvide clients with instructions on how to use our apps, normally by providing an appropriate link to documentationWrite documentation and tutorials for unanswered questions regarding our appsMaintain and expand the companies website, with blog posts8 hour shiftcss: 3 years (Required)javascript: 2 years (Preferred)html: 3 years (Required)NoHiring LabCareer AdviceBrowse JobsBrowse CompaniesSalariesIndeed EventsWork at IndeedAboutHelp Centre© 2020 IndeedPrivacy CentreCookiesPrivacyTerms","Victoria, BC",Nothing_found,"$48,000 - $64,000 a year"
Web Game Developer,software developer,SVR Automation Intelligence,"Iterate on your work, refining those areas that could use and extra coat of polish, refactoring your code to maximize its efficiency and readability.Be ever learning and researching new things, and sharing the wisdom you develop with your team, as they will with you.Be willing to create samples & prototypes at various levels of fidelity, never blindly making changes & hoping it works out. You shouldn’t ever write what you don’t understand.Take the time to annotate your code, thoroughly explaining in comments that which could be confusing to look at later and/or which operates on a paradigm which might not be immediately obvious.Have a solid understanding of the medium, including but not limited to: Node.js, Mongo DB, Socket.io, React-native, responsive web apps, and native mobile apps.Have strong written and verbal communication skills, allowing you to communicate design intent/rationale to software developers, and product managers.Be confident working independently, proactively implementing tasks & features as needed, while actively communicating with your team when uncertainty arises.Be passionate about providing our customers with a great experience using our apps.Database management: 1 year (Preferred)Node.js: 2 years (Required)Web Development: 2 years (Required)Yes, alwaysHiring LabCareer AdviceBrowse JobsBrowse CompaniesSalariesIndeed EventsWork at IndeedAboutHelp Centre© 2020 IndeedPrivacy CentreCookiesPrivacyTerms","Victoria, BC",Nothing_found,$19 - $28 an hour
Full Stack Software Developer,software developer,Optigo Networks,"Build top notch web applications for Optigo edge and cloud productsTranslate a rich feature-set on the back-end into simple to use user interfacesFull stack development with a focused on back-end componentsCandidates must be eligible for the Digital Tech Internship grant. Please see https://careerlauncher.ca/digitaltech/3+ years of experience in creating interactive and scalable software applicationsDegree in computer science, computer engineering or a related disciplineGood understanding of building applications with javascript framework such as node.js, jQuery, Angular, Express, Vue, other scripting such as Python, GO, Rust, and data handling using Json, RestFul, GraphQL, websockets, Postgres, MongoExperience with cloud applications in AWS, Azure or Google CloudExperience working with relational and nosql databasesComfortable working in a Linux environmentAdept at working in an Agile Development Environment with tools such as JIRA, Confluence, Git, Jenkins, BitbucketCapable of ramping up quickly and a willingness to learn in a startup environmentProficient oral and written communication skills. Collaborates well in a team environmentSelf-motivated and self-directed, capable of working in a remote environmentCommitted to the continuous development of your technical expertiseKnowledge of networking and control protocols. For example: Ethernet, IP, ARP, SNMP, BACnetKnowledge of Authentication, Authorization and Accounting framework such as OAuth and LDAPExperience with distributed applications designFamiliar with distributed data management such as Kafka a ZookeeperPassion for new technologies and a desire to take ownershipBonus payCasual dressWork from homeMonday to Fridaysoftware development: 3 years (Required)Cloud application development: 2 years (Required)Bachelor's Degree (Required)Yes, alwaysHiring LabCareer AdviceBrowse JobsBrowse CompaniesSalariesIndeed EventsWork at IndeedAboutHelp Centre© 2020 IndeedPrivacy CentreCookiesPrivacyTerms","Vancouver, BC",Nothing_found,"$45,000 - $75,000 a year"
Software Technical Architect,software developer,Apisero,"Languages: EnglishEducation: Master's DegreeExperience: 5 years or moreAbility to supervise: 3-4 peopleOwn Tools/Equipment: Internet access, Cellular phoneWork Conditions and Physical Capabilities: Fast-paced environment, Tight deadlines, Attention to detailPersonal Suitability: Excellent oral communication, organized, client focus, effective interpersonal skills, team player, excellent written communicationArea of Specialization: System Integration, E-commerceBusiness Equipment and Computer Applications: Eclipse, Microsoft VisioComputer Applications: SAP (FI/CO/ HR / MM / OT SD)Computer and Technology Knowledge: Salesforce, Cloud, Internet, Enterprise Applications Integration (EAI), Project management software, Programming software, HTML editing software, Website creation and management software, Web service design, Business diagram software, Mapping and data visualization software, Database software, Programming languages, Software development, Spreadsheet, Oracle, SQLManagement Systems (erp or db): MySQLOperating Systems: Linux, MS Windows, UnixProgramming Languages: Model-View-Controller (MVC), Subversion (SVN), Shell script, HTML, DHTML, XML, Technology (XSL,XSD,DTD), Java, JavaScript, JSP, CSS, Servier, Object-Oriented programming languages, Git, Groovy, XMLCollect and document user's requirements and develop logical and physical specificationsResearch, evaluate, and synthesize technical information to design, develop, and test computer-based systemsDevelop data, process and network models to optimize architecture and to evaluate the performance and reliability of designsPlan, design, and co-coordinate the development, installation, integration, and operation of computer-based systemsAssess, troubleshoot, document upgrade, and develop maintenance procedures for operating systems, communications, environments and applications softwareLead and coordinate teams of information systems professionals in the development of software and integrated information systems, process control software and other embedded software control systemsCollect and document user's requirements and develop logical and physical specificationsResearch, evaluate, and synthesize technical information to design, develop, and test computer-based systemsDevelop data, process and network models to optimize architecture and to evaluate the performance and reliability of designsPlan, design, and co-coordinate the development, installation, integration, and operation of computer-based systemsAssess, troubleshoot, document upgrade, and develop maintenance procedures for operating systems, communications, environments and applications softwareLead and coordinate teams of information systems professionals in the development of software and integrated information systems, process control software and other embedded software control systems","Vancouver, BC",Nothing_found,"$250,000 - $275,000 a year"
Software Developer,software developer,Scanline VFX,"Maintains and enhances existing CI/CD processes and key parts of the release proceduresMonitors, configures, and administers the build systemLeverages current technology research and development trends to innovate and advance Scanline VFX’s technologiesDesigns, implements, and release state-of-the-art components and applications for mission-critical, high performance, globally distributed systemsGathers requirements across large collaboration efforts that span multiple departments and/or disciplinesWrites technical briefs and user documentationPartners with software development leadership and pipeline team to identify and schedule tasksBachelor's Degree in Computer Science, Computer Engineering, or Electrical Engineering or equivalent work experienceMinimum five (5) years demonstrated work experience with PythonBasic DCC familiarity with 3ds Max, Maya, Houdini, Unreal, NukeExpert knowledge of a build and source control system (e.g. Git, Plastic)Expert knowledge Jenkins configuration and operationsExperience implementing in C/C++Good hands on experience with SQL/MySQLStrong knowledge of Windows/Linux/Mac OS environmentsStrong written and verbal communication skillsExperience with Agile methodology, test methodology, test-driven development, source control management, and automated testingDental careExtended health careLife insuranceMonday to FridayYes, temporarily due to COVID-19Hiring LabCareer AdviceBrowse JobsBrowse CompaniesSalariesIndeed EventsWork at IndeedAboutHelp Centre© 2020 IndeedPrivacy CentreCookiesPrivacyTerms","Vancouver, BC","Arts, Entertainment & Recreation","$50,338 - $148,475 a year"
Front End Developer,software developer,StealthCo,"Build WASM-based WebGL command stream interpreterImprove/extend our existing data streaming technologiesOptimize WebGL command streamReduce round-trip client-server latencyGeneral familiarity with browser-based technologiesFamiliarity with WASM and WebGLFamiliarity with Rust, C, or C++Familiarity with WebRTCStrong understanding of Rust, C, and C++Experience with WASM-JavaScript interaction layerCompetitive salary, At home perks, Group Retirement Savings Plan matching, and participation in the Employee Stock Option Plan.Comprehensive benefits package (health, dental, and vision), including generous time off policies.JavaScript: 3 years (Preferred)front end development: 3 years (Preferred)English (Required)Yes, alwaysHiring LabCareer AdviceBrowse JobsBrowse CompaniesSalariesIndeed EventsWork at IndeedAboutHelp Centre© 2020 IndeedPrivacy CentreCookiesPrivacyTerms","Vancouver, BC",Nothing_found,"$62,807 - $143,707 a year"
Senior PHP Developer,software developer,Graphem Solutions,"
$70K to $95K based on experienceFull-Time, 8:00 a.m. - 4:30 p.m.Benefits after 3 months include Health Spending account, Group Investment Plan and Flex DaysMust be legally eligible to work in Canada
Web application feature developmentAssist in developing feature specificationsPlan, code, test, and establish new features/applications/projects/modules/pluginsTroubleshoot application bugs and determine resolutionsOptimize existing code to improve performance and reliabilitySuggest improvements, security needs, best practices, etc.Work with project management tools like JiraHelp maintain server infrastructure and services
7+ years experience in back-end development5+ years experience with PHP (PHP version 7.0 preferable)3+ years experience with LaravelSolid knowledge of OOP, REST, APIsSome experience with Design Patterns and ArchitectureOutstanding verbal and written communication skillsBachelors in Computer ScienceAWSServer Management (i.e. Linux stack)Hiring LabCareer AdviceBrowse JobsBrowse CompaniesSalariesIndeed EventsWork at IndeedAboutHelp Centre© 2020 IndeedPrivacy CentreCookiesPrivacyTerms","Burnaby, BC",Information Technology,"$70,000 - $95,000 a year"
Full-Stack Developer,software developer,DMG BLOCKCHAIN SOLUTIONS,"
Enthusiasm to work in Blockchain
UI Development Experience
Javascript Development Experience
Proven ability to design software
Excellent problem-solving skills
Detail-orientation throughout the development lifecycle
Ability to work in a rapid environment with little supervision
Passion for delivering high-quality software with quick turnaround times","Vancouver, BC",Nothing_found,"$48,000 - $60,000 a year"
Senior Full Stack Developer,software developer,Defendify,"5+ years of Full-Stack Development experience.Has been responsible for the entire lifecycle of code in at least one project, from scratch to QA to deployment to maintenance.Has experience implementing a RESTful API and an application which consumes it.Is familiar with the philosophy and implementation of development automation: tests, continuous integration, cloud deployment, and frequent production releases using an Agile/SCRUM process.Some DevOps experience is a plus.Experienced in JavaScript including ES6, await/async, linting and front-end frameworks. We use libraries and frameworks as needed, but you need to be able to write and understand plain JS. Experience with Node and Browser based environments is required.Understand REST APIs and their role in application architectures.Experience with front end development: HTML, CSS, and familiarity with the ecosystem of related technologies (SASS, DOM). In addition, Vue (or similar framework) experience and knowledge of static site generators such as Jekyll/Hugo are helpful.Understand how to use Git(+Hub) and GitHub Flow.Some relational database experience is preferred. Pluses include: Experiences in relational and in-memory databases (MySQL, Postgres, Redis) as well as knowledge in generic SQL.Some experience with Amazon Web Services (AWS), Heroku, or similar services.","Vancouver, BC",Nothing_found,"$65,000 a year"
Front End Developer,software developer,Interface 48 Systems,Nothing_found,"Vancouver, BC",Nothing_found,$32 - $42 an hour
PHP Programmer,software developer,interactivetools.com,"Casual dressFlexible scheduleWork from home8 hour shiftMonday to FridayPHP: 5 years (Required)Yes, alwaysHiring LabCareer AdviceBrowse JobsBrowse CompaniesSalariesIndeed EventsWork at IndeedAboutHelp Centre© 2020 IndeedPrivacy CentreCookiesPrivacyTerms","Vancouver, BC",Nothing_found,"$60,000 - $85,000 a year"
Senior Software Engineer,software developer,Commissary Connect Innovations,"5+ years of experience working in a full stack software development roleRecent project experience with JavaScript, TypeScript and the Angular framework (V4+)Experience with PHPExperience with Node.jsStrong familiarity with database systems such as mySQL, postGresFamiliarity with designing and developing RESTful API’sExperience with high reliability distributed systemsFamiliarity with preparing requirements and design documentation","Vancouver, BC",Nothing_found,"$75,000 - $100,000 a year"
Software Development Manager (SDM),software developer,Creative Zad Services LTD,"3+ years of experience as Software Development Manager or Engineering Manager managing all aspects of software development lifecycle using Agile Project Management5+ years of experience as Software Engineer before taking the role of Software Development Manager or Engineer Manager15+ years of professional software development experience in full-stack development (front-end, back-end, and data storage)Strong architectural and system design skills in OOD, Distributed Systems and Reactive Systems ArchitectureStrong experience in Java (J2EE), Python (Flask), ReactJS, NoSQL databases (MongoDB), and front-end stack (HTML/CSS/JavaScript)Deep hands-on technical expertise: knowledge of professional software engineering practices & standard methodologies for the full software development life cycle, including coding standards, code reviews, source control management, build processes, and testingExperience with statistical modeling, data science, and machine learningExperience writing scripts to manipulate or automate data pipelinesExperience using AWS technologies like S3, Redshift, EMR, Cloudfront, EC2Experience in deployment of Micro-services and Docker instances using KubernetesExperience delivering cloud services will be a plusAgile/Scrum Certification is a plusStrong business and technical vision","Vancouver, BC",Nothing_found,"$83,119 a year"
Machine Learning Engineer,software developer,Boast.AI,"Bachelor's degree in Computer Science, related technical field or equivalent practical experience5+ years of experience developing Machine Learning or Artificial Intelligence features and applications in the SaaS software and/or fintech space5+ years of fullstack software development experienceExperience with one or more of the following: Natural Language Processing, text understanding, classification, pattern recognition, recommendation systems, targeting systems, ranking systems or similar.Experience with one or more general purpose programming languages including but not limited to: Python, Scala, Java, C, C++Knowledge of software engineering best practices across the development lifecycle, including agile methodologies, coding standards, code reviews, source management, build processes, testing, and operationsEffective written and verbal communication skillsDemonstrated problem-solving skillsAbility to work unsupervised, in the office or remote as part of a distributed team and be able to produce high quality workMS or Ph.D. degree in Computer Science, Artificial Intelligence, Machine Learning, or related technical field.Experience with Google Cloud architecture and productsExperience with one or more frameworks such as Tensorflow, Keras, Apache Beam, SparkDemonstrated leadership and self-direction. Willingness to teach others and learn new techniques.Python proficiencyInterest and ability to learn other coding languages as needed","Vancouver, BC",Nothing_found,"$80,000 - $110,000 a year"
